id,nome,ano,sinopse,genero
1,Super Mario Galaxy: O Filme,2026,"Depois de salvar o Reino dos Cogumelos, Mario e seus amigos se encontram em uma missão intergaláctica para deter um novo vilão ameaçador.",Família
2,Como Mágica,2026,Uma pequena criatura da floresta e um pássaro majestoso trocam de corpo e precisam se unir para sobreviver à aventura mais incrível de suas vidas.,Aventura
3,O Jogo do Predador,2026,"Uma mulher em luto embarca sozinha em uma aventura pela natureza selvagem da Austrália, mas acaba se envolvendo em um jogo cruel de gato e rato...",Ação
4,Malèna,2000,"Em 1941, numa pequena vila localizada na Sicília, um grupo de garotos de 13 anos de idade nutre uma profunda paixão por Malena (Monica Bellucci),...",Drama
5,Socorro!,2026,"Após um acidente aéreo, um chefe e uma funcionária que se odeiam são os únicos sobreviventes. Isolados numa ilha deserta, eles precisam decidir se...",Terror
6,O Diabo Veste Prada,2006,"Andrea Sachs é uma jovem que conseguiu um emprego na Runaway Magazine, a mais importante revista de moda de Nova York. Ela passa a trabalhar como...",Drama
7,Um Amor de Mentiras,2026,"Polina, uma estudante do ensino médio, é salva do bullying em sua nova escola e faz um acordo com o principal valentão, Bars: ele deve fingir ser...",Romance
8,Michael,2026,"A história da vida de Michael Jackson além da música, traçando sua jornada desde a descoberta de seu talento extraordinário como líder dos Jackson...",Música
9,"Cara de Um, Focinho de Outro",2026,Mabel é uma jovem amante da natureza que tenta impedir o prefeito Jerry de construir uma rodovia que destruirá suas florestas locais. Graças a um...,Aventura
10,Avatar: Fogo e Cinzas,2025,"Após a devastadora guerra contra a RDA e a perda de seu filho mais velho, Jake Sully e Neytiri enfrentam uma nova ameaça em Pandora: o Povo das...",Ficção
11,Mortal Kombat 2,2026,Os campeões favoritos dos fãs – agora acompanhados pelo próprio Johnny Cage – são colocados uns contra os outros numa sangrenta e derradeira...,Ação
12,Casamento Sangrento: A Viúva,2026,"A noiva retorna em uma nova e sinistra rodada do tradicional jogo de esconde-esconde, agora com elementos sobrenaturais e demoníacos.",Terror
13,O Diabo Veste Prada 2,2026,"Miranda Priestly navega por sua carreira em meio ao declínio das publicações tradicionais de revistas. Ela se confronta com Emily Charlton, sua...",Comédia
14,Meu Querido Assassino,2026,"Perseguida por ter um tipo sanguíneo raro, uma jovem encontra proteção nos braços de um assassino perigoso. Juntos, eles lutam para sobreviver.",Ação
15,Vingança Brutal,2026,"Quando sua esposa é brutalmente assassinada, Carlos Estrada, herói condecorado das forças especiais, passa a viver com apenas um propósito:...",Ação
16,Eles Vão te Matar,2026,"Uma mulher aceita um emprego como governanta em um arranha-céu de Nova York, sem saber da história de desaparecimentos do prédio. Ela logo percebe...",Ação
17,Hot Girls Wanted,2015,"Apresentado no Festival Sundance de Cinema de 2015, este documentário do produtor Rashida Jones investiga a indústria do pornô “amador” e as...",Documentário
18,Um Cabra Bom de Bola,2026,"Uma pequena cabra com grandes sonhos recebe uma oportunidade única na vida de se juntar aos profissionais e jogar berrobol, um esporte de alta...",Animação
19,A Lenda de Aang: O Último Mestre do Ar,2026,"O Avatar Aang, o último mestre do ar do mundo, toma conhecimento de um poder antigo que poderia salvar sua cultura da extinção. Com a ajuda de...",Animação
20,Devoradores de Estrelas,2026,O professor de ciências Ryland Grace acorda em uma espaçonave anos-luz de casa sem memória de quem ele é ou como chegou lá.,Ficção
21,POV: Presença Oculta,2026,"O que começou como uma chamada de rotina vira um pesadelo quando dois policiais se envolvem em um acidente fatal. Bryce, desesperado para proteger...",Terror
22,Missão Refúgio,2026,"Um ex-assassino de aluguel, agora um homem recluso numa ilha costeira remota, salva uma garota de uma tempestade terrível, colocando os dois na...",Ação
23,Demon Slayer: Kimetsu no Yaiba Castelo Infinito,2025,"Enquanto os membros dos caçadores e os Hashira participavam de um rigoroso programa de fortalecimento coletivo, conhecido como Treinamento dos...",Animação
24,Zootopia 2,2025,Os detetives Judy Hopps e Nick Wilde se encontram na trilha sinuosa de um réptil misterioso que chega a Zootopia e vira a metrópole dos mamíferos...,Aventura
25,O Drama,2026,"Profundamente apaixonados e em meio aos preparativos finais para o grande dia do casamento, o casal tem sua felicidade ameaçada quando vêm à tona...",Romance
26,Predador: Terras Selvagens,2025,"No futuro, em um planeta remoto, um jovem Predador, rejeitado por seu clã, encontra em Thia uma aliada improvável e embarca em uma jornada...",Ação
27,Depois que o Pornô Acaba 2,2017,"Depois que o Pornô Acaba 2 retoma o documentário anterior de onde parou, e não só volta no tempo para se encontrar com as estrelas mais antigas da...",Documentário
28,Caminhos do Crime,2026,Um ladrão enigmático realiza assaltos de alto risco ao longo da icônica rodovia 101. Quando ele mira o golpe de sua vida — na esperança de que...,Crime
29,A Guerra dos Mundos,2025,"Will Radford é um renomado analista de cibersegurança do Departamento de Segurança Interna dos Estados Unidos, encarregado de rastrear possíveis...",Ficção
30,Criaturas Extraordinariamente Brilhantes,2026,Uma viúva que trabalha como faxineira noturna em um aquário forma uma amizade improvável com um polvo gigante que a ajuda a desvendar o mistério...,Drama
31,O Último Conquistador,2026,"Com o colapso do Império Mongol, um guerreiro marcado pela guerra encara o próprio destino e rompe lealdades para proteger o futuro da Rota da Seda.",História
32,A Empregada,2025,"Millie é uma mulher passando por dificuldades que se sente aliviada com a chance de um novo começo como empregada doméstica de Nina e Andrew, um...",Mistério
33,A Sombra do Perigo,2025,"Um policial aposentado, especialista em rastreamento, é convocado de volta à ativa em Macau para desmantelar uma gangue de ladrões de alta...",Ação
34,Hotel Desire,2011,"O filme conta a história de mãe solteira Antonia. Nos oito anos que se passaram desde o nascimento de seu filho, ela parou para tomar, além de...",Drama
35,Peter Pan,1953,"Deixando o conforto e segurança de seus lares, Wendy, Miguel e João seguem Peter Pan para um mundo mágico onde a infância dura para sempre, a...",Animação
36,Interestelar,2014,As reservas naturais da Terra estão chegando ao fim e um grupo de astronautas recebe a missão de verificar possíveis planetas para receberem a...,Aventura
37,O Escondido,1987,"Nas ruas de Los Angeles, um terrível assassino fã de rock pesado, carros velozes e armas enormes está deixando uma trilha de sangue inocente. A...",Ação
38,O Último Conquistador,2026,"Com o colapso do Império Mongol, um guerreiro marcado pela guerra encara o próprio destino e rompe lealdades para proteger o futuro da Rota da Seda.",História
39,Triplo X,2002,"O ex-atleta de esportes extremos Xander ""XXX"" Cage, famoso por suas acrobacias que desafiam a morte, é convencido de que pode ter sucesso em ações...",Ação
40,Pânico 7,2026,"Quando um novo Ghostface surge na pacata cidade onde Sidney Prescott reconstruiu sua vida, seus medos mais sombrios se tornam reais enquanto sua...",Terror
41,Apocalypto,2006,"Jaguar Paw levava uma vida tranquila, que foi interrompida devido à uma invasão. Os governantes de um império maia em declínio acreditavam que a...",Ação
42,Destruição Final 2,2026,"Tendo encontrado a segurança do bunker da Groenlândia depois que o cometa Clarke dizimou a Terra, a família Garrity deve agora arriscar tudo para...",Aventura
43,Não Tenho Troco,1990,"Grimm é um assaltante que, vestido de palhaço, assalta um banco em companhia da sua namorada Phyllis e de um amigo, Loomis, que o ajudaram na...",Comédia
44,As Marvels,2023,"Quando suas obrigações a levam a uma fenda espacial anômala ligada a um revolucionário Kree, os poderes de Carol Danvers, a Capitã Marvel, se...",Ficção
45,Wormtown,2025,"Quando um culto que adora parasitas que alteram a mente toma conta de uma pequena cidade, um trio de mulheres enrustidas é arrastado para uma luta...",Ficção
46,Mortal Kombat,2021,O lutador de MMA Cole Young deve treinar para liberar seu verdadeiro poder para unir-se aos maiores campeões mundiais contra inimigos da Exoterra...,Ação
47,Bola pra Cima,2026,"Nesta comédia, os executivos de marketing Brad e Elijah se arriscam e apresentam uma proposta de patrocínio ousado de uma marca de preservativos...",Comédia
48,O Monstro da Ilha,2025,"Um grupo de caçadores viaja até uma misteriosa ilha para procurar por uma criatura lendária, mas descobrem que estão sendo usados como isca.",Terror
49,Ninfomaniaca: Volume 2,2013,"Bastante machucada e largada em um beco, Joe (Charlotte Gainsbourg) é encontrada por um homem mais velho, Seligman (Stellan Skarsgard), que lhe...",Drama
50,Super Mario Bros. O Filme,2023,"Transportados do Brooklyn para o Reino Cogumelo num passe de mágica, dois corajosos encanadores conhecem uma princesa e combatem um tirano que...",Família
51,A História de Michael Jackson,2004,Man in the Mirror: The Michael Jackson Story conta a história de Michael Jackson desde a sua humilde origem em um subúrbio de Chicago até a...,Drama
52,The Mortuary Assistant,2026,"Rebecca Owens, recém-formada em ciências mortuárias, aceita um emprego noturno na funerária River Fields. O que começa como um trabalho rotineiro...",Terror
53,Um Sonho de Liberdade,1994,"Em 1946, Andy Dufresne, um banqueiro jovem e bem sucedido, tem a sua vida radicalmente modificada ao ser condenado por um crime que nunca cometeu,...",Drama
54,O Atirador: Sem Nação,2026,"Perseguidos por mercenários, Brandon Beckett e seu lendário pai realizam um resgate impossível.",Ação
55,Vingadora,2026,"Nikki é uma ex-militar que lutou nos piores campos de batalha da guerra, mas nada se compara à dor de ter sua filha sequestrada. Caçada por...",Ação
56,Pornhub: Sexo Bilionário,2023,"Com depoimentos de artistas, defensores de sobreviventes de exploração sexual e ex-funcionários, este documentário mostra em detalhes os sucessos...",Documentário
57,Máquina de Guerra,2026,"Em sua última missão de treinamento, um engenheiro de combate precisa liderar sua equipe de elite em uma luta pela sobrevivência contra uma...",Ação
58,Aluna Exemplar e Estrela Pornô,2017,"Miriam Weeks, também conhecida como Belle Knox, ganhou notoriedade por estrelar em filmes pornográficos para pagar suas despesas na Duke...",Drama
59,Os Vingadores: The Avengers,2012,"Loki, o irmão de Thor, ganha acesso ao poder ilimitado do cubo cósmico ao roubá-lo de dentro das instalações da S.H.I.E.L.D. Nick Fury, o diretor...",Ficção
60,Michael Jackson: Searching for Neverland,2017,O que aconteceu com Michael Jackson? Esta é a história dos últimos dias do Rei do Pop e dos problemas que o levaram à morte,Drama
61,After: Depois do Desencontro,2021,"Embora a história de amor entre Tessa Young e Hardin Scott tenha passado por muitas complicações, desta vez o problema é mais complexo do que...",Drama
62,As Ovelhas Detetives,2026,"George é um pastor que lê romances policiais para suas queridas ovelhas todas as noites, acreditando que elas não conseguem entender. Mas, quando...",Comédia
63,“O Morro dos Ventos Uivantes”,2026,"O órfão Heathcliff é acolhido ainda criança pela família Earnshaw e apaixona-se pela pequena Catherine. O afeto, embora correspondido,...",Romance
64,Vingadores: Guerra Infinita,2018,"Homem de Ferro, Thor, Hulk e os Vingadores se unem para combater seu inimigo mais poderoso, o maligno Thanos. Em uma missão para coletar todas as...",Aventura
65,The Whisper,2026,"Fugindo de seu pai violento, os irmãos Lucía e Adrián se refugiam em uma mansão isolada. Com a ajuda de uma microcâmera escondida em um gato,...",Terror
66,Uma Cura de Outro Mundo,2025,"Durante a sua lua de mel, Nick encontra uma criatura alienígena no meio da floresta e decide usar os seus poderes para tentar curar a doença...",Ficção
67,Michael Jackson - A Vida de Um Ícone,2011,"Imagens inéditas, entrevistas, fotos e vídeos de performances que contam a vida de Michael Jackson. Diversos relatos de histórias públicas e...",Documentário
68,Anaconda,2025,"Uma crise de meia-idade inspira Doug e Griff a irem até a floresta amazônica para refazer o filme favorito da juventude, mas tudo muda quando uma...",Aventura
69,A Odisseia,2026,"Uma adaptação do poema de Homero de mesmo nome. Filmado em todo o mundo, este épico de ação mítico segue Odisseu enquanto ele embarca em uma...",Aventura
70,Boneco do Mal,2016,"Greta é uma jovem americana que aceita um trabalho como babá em uma pequena vila inglesa. Porém, o garoto de 8 anos de quem ela tem que cuidar é,...",Terror
71,F1: O Filme,2025,"Sonny Hayes, a lenda do automobilismo, é persuadido a deixar a aposentadoria para liderar uma equipe de Fórmula 1 em dificuldades—e ser mentor de...",Ação
72,O Poderoso Chefão,1972,"Em 1945, Don Corleone é o chefe de uma mafiosa família italiana de Nova York. Ele costuma apadrinhar várias pessoas, realizando importantes...",Drama
73,O Genro,2026,"Depois de seguir um caminho difícil, José Sánchez se torna um temido operador político. Mas, desta vez, seu bigode marcante e a língua afiada não...",Comédia
74,Monstro a Bordo,2024,"O Dr. Sigh tenta trazer uma misteriosa criatura de uma terra distante para a Alemanha. Mas após o avião ser atingido por uma turbulência, a...",Terror
75,Minha Culpa,2023,"Noah é obrigada a mudar de cidade, deixando seus amigos e namorado para trás, após sua mãe se casar com um novo marido rico. Lá ela conhece Nick,...",Drama
76,Influencers,2025,"Tentando deixar seu passado sombrio para trás, a perigosa CW vive agora uma vida tranquila e idílica no sul da França ao lado de sua namorada,...",Terror
77,Invocação do Mal 4: O Último Ritual,2025,O casal de investigadores Ed e Lorraine Warren assume um novo caso de horror sobrenatural que os força a um confronto derradeiro. Para vencer esta...,Terror
78,Uma História de Sobrevivência,2023,A notável história real de sobrevivência de um menino judeu que se esconde e é caçado nas florestas da Europa Oriental ocupada pelos nazistas.,Drama
79,"Para Eles, Com Muito Amor",1991,"A história dos comediantes e cantores Eddie Sparks e Dixie Leonard, que levaram diversão aos soldados da II Guerra Mundial, Coreia e Vietnã....",Drama
80,Maldição da Múmia,2026,"A filha de um jornalista desaparece num deserto sem deixar rastros, deixando a família dilacerada e em luto. Até que, oito anos mais tarde, a...",Terror
81,Lindas e Letais,2026,"Um thriller repleto de ação no qual cinco bailarinas, perdidas em uma floresta remota a caminho de uma competição de dança, encontram abrigo em...",Música
82,Guerreiras do K-Pop,2025,"Quando não estão lotando estádios, as estrelas do K-pop Rumi, Mira e Zoey usam seus poderes secretos para proteger os fãs contra ameaças...",Fantasia
83,A Origem,2010,Cobb é um ladrão habilidoso que comete espionagem corporativa infiltrando-se no subconsciente de seus alvos durante o estado de sono. Impedido de...,Ação
84,Matrix,1999,O jovem programador Thomas Anderson é atormentado por estranhos pesadelos em que está sempre conectado por cabos a um imenso sistema de...,Ação
85,Pulp Fiction: Tempo de Violência,1994,"Vincent Vega e Jules Winnfield são dois assassinos profissionais que trabalham fazendo cobranças para Marsellus Wallace, um poderosos gângster....",Suspense
86,Parasita,2019,"Toda a família de Ki-taek está desempregada, vivendo num porão sujo e apertado. Uma obra do acaso faz com que o filho adolescente da família...",Comédia
87,Preparada para a Guerra,2025,"Cinco anos após uma ruptura na realidade trazer criaturas aterrorizantes para o nosso mundo, a civilização entrou em colapso. A trama acompanha um...",Ficção
88,O Senhor dos Anéis: O Retorno do Rei,2003,O confronto final entre as forças do bem e do mal que lutam pelo controle do futuro da Terra-Média se aproxima. Sauron planeja um grande ataque a...,Aventura
89,Jovem e Bela,2013,"Depois de perder a virgindade, Isabelle assume uma vida secreta como garota de programa, conhecendo seus clientes para encontros em quartos de...",Drama
90,Ataque Brutal,2026,"Em meio a um furacão devastador, uma comunidade costeira luta pela sobrevivência, assolada não apenas pelas forças destrutivas da natureza, mas...",Terror
91,A Iniciação,1986,O filme mostra a iniciação sexual de Roger um menino de 16 anos que passa férias em uma mansão cheia de mulheres.,Comédia
92,Extermínio: O Templo dos Ossos,2026,Dr. Kelson se vê envolvido num novo relacionamento chocante – com consequências que podem mudar o mundo como eles o conhecem – e o encontro de...,Terror
93,Batman: O Cavaleiro das Trevas,2008,"Após dois anos desde o surgimento do Batman, os criminosos de Gotham City têm muito o que temer. Com a ajuda do tenente James Gordon e do promotor...",Ação
94,Homem-Aranha: Sem Volta Para Casa,2021,Peter Parker é desmascarado e não consegue mais separar sua vida normal dos grandes riscos de ser um super-herói. Quando ele pede ajuda ao Doutor...,Ação
95,Truque de Mestre: O 3° Ato,2025,"Os Quatro Cavaleiros estão de volta com uma nova geração de ilusionistas e uma trama cheia de reviravoltas, mágicas e surpresas, em um truque que...",Crime
96,O Limite do Prazer,2023,"Quando o recluso Franklin trai sua garota com uma mulher misteriosa que ele conhece em um aplicativo de namoro, isso se torna o início de uma...",Suspense
97,Mike & Nick & Nick & Alice,2026,"Uma comédia de ação hilária e estilizada, para maiores de 18 anos, sobre dois gângsteres e a mulher que eles amam, tentando sobreviver à noite...",Comédia
98,Jurassic World: Recomeço,2025,"Cinco anos após os eventos de Jurassic World: Domínio, a ecologia do planeta se mostrou inóspita para os dinossauros, com os poucos sobreviventes...",Ficção
99,Starbright,2026,"Uma jovem órfã escapa da realidade fantasiando com um mundo de conto de fadas, até que acaba entrando nele.",Aventura
100,Deadpool & Wolverine,2024,"Um apático Wade Wilson trabalha duro na vida civil. Seus dias como mercenário moralmente flexível, Deadpool, ficaram para trás. Quando seu planeta...",Ação
101,"Da Toscana, com Amor",2026,"Baseado no best-seller de Felicia Kingsley, Elisa (34) e Michele (32) são muito diferentes. Ela é uma mãe jovem, solteira, dedicada ao trabalho....",Romance
102,Peter Pan,1953,"Deixando o conforto e segurança de seus lares, Wendy, Miguel e João seguem Peter Pan para um mundo mágico onde a infância dura para sempre, a...",Animação
103,180,2026,"Depois que um incidente no trânsito deixa seu filho em estado crítico, um pai com sangue nos olhos embarca em um caminho sombrio de caos e vingança.",Suspense
104,Dinheiro Suspeito,2026,"Quando uma equipe de policiais de Miami encontra milhões de dólares em um muquifo usado como esconderijo, a confiança fica abalada e todos viram...",Ação
105,A Viagem de Chihiro,2001,"Chihiro e seus pais estão se mudando para uma cidade diferente. A caminho da nova casa, o pai decide pegar um atalho. Eles se deparam com uma mesa...",Animação
106,Forrest Gump: O Contador de Histórias,1994,"Quarenta anos da história dos Estados Unidos, vistos pelos olhos de Forrest Gump, um rapaz com QI abaixo da média e com boas intenções. Por obra...",Comédia
107,Top Gun: Maverick,2022,"Depois de mais de 30 anos de serviço como um dos principais aviadores da Marinha, Pete ""Maverick"" Mitchell está de volta, rompendo os limites como...",Ação
108,Truque de Mestre: O 3° Ato,2025,"Os Quatro Cavaleiros estão de volta com uma nova geração de ilusionistas e uma trama cheia de reviravoltas, mágicas e surpresas, em um truque que...",Crime
109,Pecadores,2025,"Dispostos a deixar suas vidas conturbadas para trás, irmãos gêmeos retornam à sua cidade natal para recomeçar suas vidas do zero, quando descobrem...",Terror
110,Justiça Artificial,2026,"Em um futuro próximo, um detetive é acusado de assassinar a própria esposa. Ele tem 90 minutos para provar sua inocência à avançada justiça de...",Ficção
111,Terror em Silent Hill: Regresso Para o Inferno,2026,"Quando uma carta misteriosa chama James de volta a Silent Hill em busca de seu verdadeiro amor, ele encontra uma cidade antes reconhecível,...",Mistério
112,Secretária,2002,"Uma jovem acaba de receber alta de um hospital psiquiátrico e consegue um trabalho como secretária de um advogado exigente. Lentamente, sua...",Romance
113,Os Bons Companheiros,1990,"A história real de Henry Hill, um garoto meio irlandês e meio siciliano do Brooklyn que é adotado por gangsters do bairro ainda jovem e sobe na...",Drama
114,O Som da Morte,2026,"Um grupo de estudantes disfuncionais se depara com um Apito da Morte asteca amaldiçoado. Logo, eles descobrem que usar o objeto produz um som...",Terror
115,O Senhor dos Anéis: A Sociedade do Anel,2001,"Após herdar um anel de seu tio, o hobbit Frodo participa da missão de salvar a Terra-Média do perverso Sauron. Ele precisa conduzir o Um Anel até...",Aventura
116,À Espera de um Milagre,1999,"Milagres acontecem em lugares inesperados, mesmo no bloco de celas para o corredor da morte na Penitenciária Cold Mountain. Lá, John Coffey, um...",Fantasia
117,Ted 2,2015,"O urso de pelúcia Ted casa-se com Tami-Lynn. O casal pretende ter um bebê, mas para terem direito à inseminação artificial, Ted tem que provar na...",Comédia
118,Entre Montanhas,2025,Dois agentes altamente treinados se aproximam à distância após serem enviados para proteger lados opostos de um desfiladeiro misterioso. Quando um...,Romance
119,O Escondido,1987,"Nas ruas de Los Angeles, um terrível assassino fã de rock pesado, carros velozes e armas enormes está deixando uma trilha de sangue inocente. A...",Ação
120,Chainsaw Man – O Filme: Arco da Reze,2025,"Denji trabalhava como Caçador de Demônios para a yakuza, tentando pagar a dívida que herdou de seus pais, até que um dia, ele é traído e morre. Em...",Animação
121,Drácula - Uma História de Amor Eterno,2025,"No século XV, o príncipe Vlad II perde o seu amor, a princesa Elisabeta. Tomado pela dor, rejeita a Deus e herda uma maldição eterna: vira o Conde...",Terror
122,Divertida Mente 2,2024,"""Divertida Mente 2"", da Disney e da Pixar, retorna à mente da adolescente Riley, e o faz no momento em que a sala de comando está passando por uma...",Animação
123,Clube da Luta,1999,Um homem deprimido que sofre de insônia conhece um estranho vendedor de sabonetes chamado Tyler Durden. Eles formam um clube clandestino com...,Drama
124,A Breed Apart,2025,"Violet, uma rebelde que procura cães abandonados em uma ilha remota, se encontra em uma situação angustiante, cheia de terror e caos movido a...",Terror
125,Kung Fu Panda 4,2024,"Po está prestes a se tornar o novo líder espiritual do Vale da Paz, mas antes que possa fazer isso, ele deve encontrar um sucessor para se tornar...",Ação
126,Titanic,1997,"Um artista pobre e uma jovem rica se conhecem e se apaixonam na fatídica jornada do Titanic, em 1912. Embora esteja noiva do arrogante herdeiro de...",Drama
127,Hamnet: A Vida Antes de Hamlet,2025,"Um dos mais importantes escritores do cânone ocidental, William Shakespeare vive uma tragédia ao lado de sua esposa Agnes quando o casal perde o...",Drama
128,Oppenheimer,2023,"A história do físico americano J. Robert Oppenheimer, seu papel no Projeto Manhattan e no desenvolvimento da bomba atômica durante a Segunda...",Drama
129,Superman,2025,"Superman, um jovem repórter de Metrópolis, embarca em uma jornada para reconciliar sua herança kryptoniana com sua criação humana como Clark Kent.",Ficção
130,Hellfire,2026,Um andarilho com um passado misterioso chega a uma pequena cidade e descobre que os moradores estão sob o controle de um chefe do crime...,Ação
131,O Sobrevivente,2025,"Em um futuro próximo, ""O Sobrevivente"" é o show de maior audiência na televisão – uma competição mortal onde os participantes precisam sobreviver...",Ação
132,Meu Nome é Agneta,2026,"Ansiosa por um recomeço e desempregada, Agneta aceita trabalhar como au pair na Provença, uma mudança de cenário muito bem-vinda — acompanhada de...",Comédia
133,Inteligência Humana,2026,"Ao investigar um cartel russo, um agente sul-coreano fica cara a cara com um agente norte-coreano, e ambos são dragados por perigos e segredos.",Suspense
134,A Lista de Schindler,1993,O alemão Oskar Schindler viu na mão de obra judia uma solução barata e viável para lucrar com negócios durante a guerra. Com sua forte influência...,Drama
135,Oppenheimer,2023,"A história do físico americano J. Robert Oppenheimer, seu papel no Projeto Manhattan e no desenvolvimento da bomba atômica durante a Segunda...",Drama
136,Kung Fu Panda 4,2024,"Po está prestes a se tornar o novo líder espiritual do Vale da Paz, mas antes que possa fazer isso, ele deve encontrar um sucessor para se tornar...",Ação
137,Beekeeper: Rede de Vingança,2024,"Clay está em busca de vingança e não vai parar até acabar com o sistema criminoso responsável pela morte de sua amiga. O plano brutal de Clay, um...",Ação
138,Bom Caminho,2025,"Um pai decide percorrer o Caminho de Santiago a pé em busca da filha desaparecida. A cada passo, ele aprende a se tornar um homem melhor.",Comédia
