id,nome,ano,sinopse,genero
686,Boca de Fumo,2025,"Em El Paso, Texas, um agente disfarçado da Narcóticos e seu parceiro brincam de gato e rato com um grupo ousado de ladrões: seus próprios filhos...",Ação
687,O Troll da Montanha 2,2025,"O despertar de um novo troll causa devastação na Noruega. Agora, Nora, Andreas e o capitão Kris terão que encarar a missão mais perigosa de suas...",Ação
688,Babysitters de Luxo,2008,"De um romance com o pai das crianças de quem cuidava, uma estudante inicia uma agência de babás, que oferece garotas de programa adolescentes para...",Drama
689,Karate Kid,2010,"Dre Parker se mudou com a mãe para Pequim, devido ao trabalho dela. Logo ao chegar, ele se interessa por Meiying, uma garota que conhece...",Ação
690,Sr. & Sra. Smith,2005,"John e Jane Smith aparentemente parecem formar um casal normal, mas na realidade ambos mantêm um segredo. Os dois são assassinos de aluguel...",Ação
691,Gente Grande 2,2013,"Lenny Feder e sua família se mudam para sua cidade natal para ficar perto dos amigos, mas acabam tendo que enfrentar alguns fantasmas do passado,...",Comédia
692,Demon Slayer: Mugen Train - O Filme,2020,"Tanjiro, Inosuke e Zenitsu são enviados pelo comando do Esquadrão de Exterminadores para uma missão no Trem Infinito, onde devem se encontrar com...",Animação
693,A Freira,2018,"Presa em um convento na Romênia, uma freira comete suicídio. Para investigar o caso, o Vaticano envia um padre assombrado e uma noviça prestes a...",Terror
694,Laranja Mecânica,1971,"Em uma Inglaterra do futuro, um membro de uma gangue de delinquentes tenta desligar-se, mas é espancado pelos demais e deixado ao abandono para...",Ficção
695,Um Lugar Silencioso,2018,"Em uma fazenda dos Estados Unidos, uma família do meio-oeste é perseguida por uma entidade fantasmagórica assustadora. Para se protegerem, eles...",Terror
696,007: Sem Tempo para Morrer,2021,"Bond deixou o serviço ativo e está desfrutando de uma vida tranquila na Jamaica. Sua paz é interrompida quando o seu velho amigo Felix Leiter, da...",Ação
697,O Exterminador do Futuro 3: A Rebelião das Máquinas,2003,"Na intenção de concluir a missão ainda inacabada, a bela e perigosa máquina mortífera T-X é enviada para matar John Connor, líder da resistência...",Ação
698,Uma Babá Quase Perfeita,1993,"Daniel Hillard está passando por uma fase complicada, acaba de se separar de Miranda e perdeu o seu emprego. Impedido pela ex-esposa de passar...",Comédia
699,O Pequenino,2006,"O anão Calvin mal saiu da prisão e já planeja um novo assalto a uma joalheria. Perseguido pela polícia, ele esconde o diamante na bolsa de...",Comédia
700,O Beijo da Mulher Aranha,2025,"Para sobreviver ao confinamento e à tortura, Molina usa a imaginação para contar a história de um musical hollywoodiano que o fascina. Ele narra a...",Romance
701,Invocação do Mal 3: A Ordem do Demônio,2021,Um dos casos mais sensacionais de seus arquivos começa com a luta pela alma de um garoto e depois os leva para além de qualquer coisa que já...,Terror
702,X-Men: Apocalipse,2016,"Apocalipse, o primeiro mutante de todos, consegue retornar à vida após milhares de anos. Agora, ele sai à procura de seguidores para dominar o...",Ficção
703,A Fantástica Fábrica de Chocolate,2005,"Willy Wonka é o excêntrico dono da maior fábrica de doces do planeta, que decide realizar um concurso mundial para escolher um herdeiro para seu...",Aventura
704,Sicario: Terra de Ninguém,2015,"Na crescente fronteira sem lei entre os Estados Unidos e o México, uma agente do FBI é exposta ao mundo brutal do tráfico internacional de drogas...",Ação
705,O Mago do Kremlin,2026,"Após a queda da URSS, um artista genial se torna a mente sombria por trás do poder de Vladimir Putin. Vadim Baranov era produtor de TV, mestre em...",Drama
706,Harakiri,1962,"No século 18, o Japão não está mais em guerra e o país é governado com firmeza. Hanshiro Tsugumo, um dos muitos ronin (samurais errantes)...",Ação
707,The 3DD Invader,2011,"The 3DD Invader é um filme de comédia sexual de ficção científica de Hong Kong de 2011, dirigido por Cash Chin. O filme é estrelado por Macy Wu...",Comédia
708,Kingsman: Serviço Secreto,2015,"Eggsy é um jovem com problemas de disciplina que parece perto de se tornar um criminoso. Determinado dia, ele entra em contato com Harry, que lhe...",Crime
709,Babygirl,2024,Romy é uma executiva que conquistou seu posto como CEO com muita dedicação. O mesmo se aplica a sua família e o casamento com Jacob. Tudo o que...,Romance
710,Noite da Pizza,2026,"Um grupo de universitários desce para pegar uma pizza no saguão. Só tem um problema: eles estão doidões com uma droga caseira, e a simples jornada...",Comédia
711,O Exterminador do Futuro: Gênesis,2015,"John Connor, líder da resistência humana contra Skynet, envia Kyle Reese de volta a 1984 para proteger sua mãe, Sarah. Porém, Reese se surpreende...",Ficção
712,Grease: Nos Tempos da Brilhantina,1978,"Na Califórnia de 1959, a boa moça Sandy e o metido Danny se apaixonam e aproveitam um verão inesquecível na praia. Quando voltam às aulas, eles...",Romance
713,Animais Fantásticos e Onde Habitam,2016,"O ano é 1926 e algo misterioso, que ameaça expor o mundo bruxo, está deixando rastros de destruição nas ruas de Nova York. Newt Scamander chega à...",Fantasia
714,X: A Marca da Morte,2022,"Em 1979, um grupo de jovens cineastas se propôs a fazer um filme adulto na zona rural do Texas, mas quando seus solitários e idosos anfitriões os...",Terror
715,O Incrível Hulk,2008,"Vivendo escondido e longe de Betty Ross, a mulher que ama, o cientista Bruce Banner busca um meio de retirar a radiação gama que está em seu...",Ficção
716,Os Sonhadores,2003,"Em meio a tumultos políticos, três estudantes se vêem atraídos por sua paixão pelo cinema... e uns pelos outros! Enquanto seus pais estão de...",Drama
717,O Homem Cobra,1973,"Um respeitado especialista em cobras esconde o assustador desejo, de transformar um ser humano no maior dos répteis. Percebendo que seu novo...",Terror
718,Tiros em Columbine,2002,"Documentário que investiga a fascinação dos americanos pelas armas de fogo. Michael Moore, diretor e narrador do filme, questiona a origem dessa...",Documentário
719,Amor e Outras Drogas,2010,"Maggie é uma mulher de espírito livre que não quer se amarrar a alguém de maneira alguma. Ela só não esperava conhecer Jamie, um charmoso vendedor...",Drama
720,Histórias Cruzadas,2011,"Nos anos 60, no Mississippi, Skeeter é uma garota da sociedade que retorna determinada a se tornar escritora. Ela começa a entrevistar as mulheres...",Drama
721,Diário Proibido,2008,"Valére (Belén Fabra) é uma jovem empresária de sucesso, que tem uma intensa vida sexual. Ela possui um diário, onde costuma escrever suas...",Drama
722,Curral de Mulheres,1982,Grupo de marginais aprisiona moças para vendê-las como objetos de prazer. Elas são postas num curral numa fazenda e submetidas a toda espécie de...,Suspense
723,Alien: Covenant,2017,"Viajando pela galáxia, os tripulantes da nave colonizadora Covenant encontram um planeta remoto com ares de paraíso inexplorado. Encantados, eles...",Terror
724,Dunkirk,2017,"Durante a Segunda Guerra Mundial, em maio de 1940, cerca de 400.000 soldados britânicos, franceses e belgas viram-se cercados pelas tropas alemãs...",Guerra
725,Fragmentado,2017,"Embora Kevin tenha revelado 23 personalidades a seu psiquiatra, uma ainda permanece submersa, pronta para se materializar e dominar todas as...",Terror
726,Como Treinar o Seu Dragão 3,2019,"Decidido a fazer de Berk um verdadeiro libelo ao ideal da convivência pacífica entre homens e dragões, Soluço e seus amigos seguem atrás de...",Animação
727,Homem-Formiga,2015,"Dr. Hank Pym, o inventor da fórmula/traje que permite o encolhimento, precisa impedir que seu ex-pupilo Darren Cross consiga replicar o feito e...",Ficção
728,A Princesa e o Sapo,2009,"Desde criança, Tiana sonha em ter um restaurante próprio. Para conseguir a quantia necessária para que possa finalmente alugar o imóvel de seus...",Animação
729,300,2007,"Em 480 a.C., Leônidas, o rei de Esparta, comanda seu pequeno batalhão de 300 soldados contra um exército de mais de 1 milhão de persas na Batalha...",Ação
730,Kung-Fusão,2004,"Em uma cidade controlada pela gangue Axe, o ladrão de segunda categoria Sing quer desesperadamente se tornar um membro. Ele vai para um cortiço...",Ação
731,Sing 2,2021,Buster Moon e seus amigos devem persuadir o recluso astro do rock Clay Calloway a se juntar a eles para a abertura de um novo show.,Animação
732,As Aventuras de Pi,2012,"Pi Patel é filho do dono de um zoológico localizado em Pondicherry, na Índia. Após anos cuidando do negócio, a família decide vender o...",Aventura
733,O Regresso,2015,"Durante uma expedição em uma selvagem região americana, o lendário explorador Hugh Glass é brutalmente atacado por um urso e deixado para morrer...",Faroeste
734,Looper: Assassinos do Futuro,2012,"Na sociedade futurística de 2074, a viagem no tempo só está disponível a quem é capaz de pagar por ela no mercado negro. Quando os mafiosos querem...",Ação
735,Kung Fu Panda 2,2011,"Po vive o sonho de ser o dragão guerreiro, protegendo o Vale da Paz ao lado dos mestres Shifu, Tigresa, Macaco, Víbora, Louva-deus e Garça. Sua...",Animação
736,O Bom Bandido,2025,"Um criminoso carismático durante sua fuga da polícia, assume uma nova identidade e começa a trabalhar em uma loja de brinquedos. Lá, se envolve...",Crime
737,Michael Jackson: Thriller,2008,Uma noite no cinema se transforma em um pesadelo quando Michael e seu par são atacados por uma horda de zumbis sedentos de sangue - apenas um...,Terror
738,Pânico VI,2023,"Sam, Tara, Chad e Mindy, os quatro sobreviventes do massacre realizado pelo Ghostface, decidem deixar Woodsboro para trás em busca de um novo...",Terror
739,Busca Implacável,2008,"Bryan Mills é um ex-agente do governo, que deixou o emprego para que pudesse passar mais tempo com Kim, a filha que teve com sua ex-esposa Lenore....",Ação
740,Grease: Nos Tempos da Brilhantina,1978,"Na Califórnia de 1959, a boa moça Sandy e o metido Danny se apaixonam e aproveitam um verão inesquecível na praia. Quando voltam às aulas, eles...",Romance
741,Histórias Cruzadas,2011,"Nos anos 60, no Mississippi, Skeeter é uma garota da sociedade que retorna determinada a se tornar escritora. Ela começa a entrevistar as mulheres...",Drama
742,Superbad: É Hoje,2007,Os estudantes adolescentes Seth e Evan têm grandes esperanças para uma festa de formatura. Os adolescentes co-dependentes pretendem beber e...,Comédia
743,Salve Geral: Irmandade,2026,"Durante uma onda de violência sem precedentes em São Paulo, uma advogada ligada ao crime precisa fazer um acordo com a polícia para resgatar a...",Ação
744,Ponyo - Uma Amizade que Veio do Mar,2008,"Um garoto de 5 anos chamado Sosuke fica amigo de uma princesa peixinho-dourado chamada Ponyo, que quer desesperadamente virar humana.",Animação
745,Pânico,2022,"Vinte e cinco anos após uma série de crimes brutais chocar a tranquila Woodsboro, um novo assassino se apropria da máscara de Ghostface e começa a...",Terror
746,O Planeta dos Macacos,1968,"George Taylor, um astronauta americano, viaja por séculos em estado de hibernação. Ao acordar, ele e seus companheiros se vêem em um planeta...",Ficção
747,O Lado Bom da Vida,2012,"Ao perder o emprego e a esposa, Pat Solatano vai morar com os pais. Ele quer reconstruir sua vida, mas seus pais ficariam felizes se ele...",Drama
748,Venom: Tempo de Carnificina,2021,"Em busca de seu próximo furo de reportagem, o jornalista Eddie Brock consegue uma entrevista exclusiva com Cletus Kasady, um assassino no corredor...",Ficção
749,Cisne Negro,2010,Nina é uma bailarina cuja obsessão pela dança supera todas as facetas de sua vida. Quando o diretor artístico da companhia decide substituir sua...,Drama
750,Calígula,1979,"Após a morte do paranoico imperador Tibério, Calígula, seu herdeiro, toma o poder e mergulha o império em uma espiral sangrenta de loucura e...",Drama
751,Se Não Fosse Você,2025,Morgan Grant e sua filha Clara precisam lidar com o que ficou após um acidente devastador revelar uma traição chocante e forçá-las a confrontar...,Romance
752,Todo Mundo em Pânico 2,2001,"Brincando com o terror, o professor Oldman e Dwight seu assistente, preparam um final de semana hilariante e super especial. Um experiência sobre...",Comédia
753,007: Sem Tempo para Morrer,2021,"Bond deixou o serviço ativo e está desfrutando de uma vida tranquila na Jamaica. Sua paz é interrompida quando o seu velho amigo Felix Leiter, da...",Ação
754,Lilo & Stitch,2002,Lilo é uma garotinha de cinco anos que ama cuidar de animais. Um dia ela adota um cachorro e decide chamá-lo de Stitch. O que ela não sabe é que...,Animação
755,Planeta dos Macacos: O Confronto,2014,"Em 2026, a humanidade está enfrentando sua pior crise e está muito próxima da extinção por conta de um vírus mortal. Um grupo de sobreviventes...",Ficção
756,O Boneco de Barro,2025,A vontade de um designer de videogames é testada quando um espírito misterioso se infiltra em sua nova família e ameaça a vida de sua futura esposa.,Terror
757,Monster,2023,"Uma mãe sente que há algo errado quando seu filho começa a se comportar de maneira estranha. Ao descobrir que um professor é o responsável, ela...",Mistério
758,Guerra nas Estrelas: O Retorno de Jedi,1983,O imperador está supervisionando a construção de uma nova Estrela da Morte. Enquanto isso Luke Skywalker liberta Han Solo e a Princesa Leia das...,Aventura
759,O Exterminador do Futuro: Gênesis,2015,"John Connor, líder da resistência humana contra Skynet, envia Kyle Reese de volta a 1984 para proteger sua mãe, Sarah. Porém, Reese se surpreende...",Ficção
760,X-Men: Apocalipse,2016,"Apocalipse, o primeiro mutante de todos, consegue retornar à vida após milhares de anos. Agora, ele sai à procura de seguidores para dominar o...",Ficção
761,A Era do Gelo 2,2006,"O aquecimento global traz ameaças de inundações generalizadas a regiões que antes eram geladas. Manny, Sid e Diego partem em busca de um refúgio...",Animação
762,Fragmentado,2017,"Embora Kevin tenha revelado 23 personalidades a seu psiquiatra, uma ainda permanece submersa, pronta para se materializar e dominar todas as...",Terror
763,Nascido Para Matar,1987,"Um sargento treina de forma fanática e sádica os recrutas em uma base de treinamentos, na intenção de transformá-los em máquinas de guerra para...",Drama
764,The 3DD Invader,2011,"The 3DD Invader é um filme de comédia sexual de ficção científica de Hong Kong de 2011, dirigido por Cash Chin. O filme é estrelado por Macy Wu...",Comédia
765,Destruição Final: O Último Refúgio,2020,"Quando cientistas descobrem que um cometa atingirá a Terra em poucos dias e provavelmente causará a extinção da humanidade, uma família tenta...",Suspense
766,Babysitters de Luxo,2008,"De um romance com o pai das crianças de quem cuidava, uma estudante inicia uma agência de babás, que oferece garotas de programa adolescentes para...",Drama
767,Sing - Quem Canta Seus Males Espanta,2016,Um empolgado coala chamado Buster decide criar uma competição de canto para aumentar os rendimentos de seu antigo teatro. A disputa movimenta o...,Animação
768,Resistência,2023,"Em meio a uma futura guerra entre a raça humana e as forças da inteligência artificial, Joshua, um endurecido ex-agente das forças especiais que...",Ficção
769,007: Operação Skyfall,2012,"Após uma missão mal sucedida de James Bond, a identidade de agentes secretos é revelada e o M16, atacado. Ajudado por um agente de campo, Bond...",Ação
770,Caos e Destruição,2025,"Um roubo de drogas sai do controle, levando um policial a encarar o submundo de uma cidade corrupta para salvar o filho de um político importante.",Ação
771,Star Wars: Episódio II - Ataque dos Clones,2002,"Com a missão de proteger a Senadora Amidala, Anakin Skywalker descobre o seu amor por ela, do mesmo modo que vai conhecendo seu lado sombrio....",Aventura
772,Ghost in the Shell: O Fantasma do Futuro,1995,"Major Motoko Kusanagi, uma ciborgue do Setor de Segurança Pública 9, recebe a missão de capturar um hacker que está dominando a mente de humanos...",Ação
773,A Soma de Todos os Medos,2002,"A Guerra Fria americana é revivida, depois que o presidente da Rússia morre e é sucedido por um homem de passado obscuro. Mas as tensões...",Suspense
774,Dia D,2026,A existência de vida extraterrestre torna-se uma realidade inegável para todos os habitantes da Terra em um único instante. O mundo entra em...,Mistério
775,Jogos Mortais,2004,Dois homens acordam acorrentados em um banheiro como prisioneiros de um assassino em série que leva suas vítimas a situações limítrofes em um jogo...,Terror
776,Alien: Covenant,2017,"Viajando pela galáxia, os tripulantes da nave colonizadora Covenant encontram um planeta remoto com ares de paraíso inexplorado. Encantados, eles...",Terror
777,O Tempo com Você,2019,"O estudante Hodaka foge de sua casa em uma ilha periférica e se muda para Tóquio, onde faz amizade com Hina. Ela tem um poder que deixa Hodaka...",Animação
778,O Macaco,2025,"Dois irmãos gêmeos encontram um macaco de brinquedo que pertenceu ao seu pai. Quando percebem coisas sinistras acontecendo à sua volta, os dois se...",Terror
779,Halloween - A Noite do Terror,1978,"Na noite de Halloween de 1963, Michael Myers, de seis anos, assassina brutalmente sua irmã. Preso em uma instituição para doentes mentais sob os...",Terror
780,Lucy,2014,"Quando a inocente jovem Lucy (Scarlett Johansson) aceita transportar drogas dentro do seu estômago, ela não conhece muito bem os riscos que corre....",Ação
781,Transformers: O Início,2024,Veja a história não contada da origem de Orion Pax (o jovem Optimus Prime) e D-16 (o jovem Megatron) e descubra como estes dois companheiros de...,Animação
782,Transformers: A Era da Extinção,2014,"Após a batalha entre os Autobots e os Decepticons, que arrasou Chicago, os gigantescos robôs alienígenas desapareceram. Atualmente, eles são...",Ficção
783,O Bom Bandido,2025,"Um criminoso carismático durante sua fuga da polícia, assume uma nova identidade e começa a trabalhar em uma loja de brinquedos. Lá, se envolve...",Crime
784,Akira,1988,"Uma grande explosão fez com que Tóquio fosse destruída em 1988. Em seu lugar, foi construída Neo-Tóquio, que, em 2019, sofre com atentados...",Animação
785,Solo Mio,2026,"Com o coração partido em Roma após um desastre no casamento, um noivo encalhado encontra sua lua de mel arruinada transformada por um morador...",Romance
786,300,2007,"Em 480 a.C., Leônidas, o rei de Esparta, comanda seu pequeno batalhão de 300 soldados contra um exército de mais de 1 milhão de persas na Batalha...",Ação
787,Pânico na Floresta 3,2009,"Uma van cheia de prisioneiros é puxada para fora da estrada por um canibal louco, eles precisam lutar por sua sobrevivência em uma floresta cheia...",Terror
788,Karatê Kid: Lendas,2025,"Li Fong, um prodígio do kung fu, se muda para Nova York com a mãe. Ele tenta ficar longe de brigas enquanto se adapta ao novo país, mas sua paixão...",Ação
789,O Bad Boy e Eu,2025,"Dallas sonha em entrar para a melhor escola de dança do país e honrar a memória de sua mãe. Tudo parecia sob controle… até Drayton Lahey, o bad...",Comédia
790,Cães de Aluguel,1992,"Seis homens, completamente estranhos uns aos outros, realizam um roubo de diamantes que dá errado e vira uma emboscada sangrenta. Quando os...",Crime
791,O Sexto Sentido,1999,"Dr. Malcolm Crowe é um conceituado psicólogo infantil, que vive atormentado pela terrível lembrança de um jovem paciente que ele não foi capaz de...",Mistério
792,A Bruxa - Parte 2: A Colisão,2022,"Uma garota acorda em um enorme laboratório secreto e por acidente, conhece uma garota que está tentando proteger sua casa de uma gangue. A garota...",Ação
793,O Labirinto do Fauno,2006,"Espanha, 1944. Ofelia se muda com sua mãe para uma guarnição dirigida por seu padrasto, Vidal, um capitão autoritário do exército de Franco. Perto...",Fantasia
794,Garota Infernal,2009,"Ao ser possuída por um demônio, a estudante Jennifer se torna muito brava com os rapazes que nunca a deram uma chance. Enquanto a maldosa Jennifer...",Terror
795,Busca Implacável 3,2014,"O ex-agente do governo norte-americano Bryan Mills tenta tornar-se um homem família, mas vê tudo ruir quando sua esposa, Lenore, é assassinada....",Suspense
796,John Wick 3: Parabellum,2019,"Após assassinar o chefe da máfia Santino D'Antonio no Hotel Continental, John Wick passa a ser perseguido pelos membros da Alta Cúpula sob a...",Ação
797,Crepúsculo: Eclipse,2010,"Bella mais uma vez encontra-se rodeada pelo perigo, já que Seattle está sendo devastada por uma sequência de misteriosos assassinatos e um...",Aventura
798,Velozes & Furiosos: Hobbs & Shaw,2019,O corpulento policial Luke Hobbs se junta ao fora da lei Deckard Shaw para combater um terrorista geneticamente melhorado que tem força sobre-humana.,Ação
799,Akira,1988,"Uma grande explosão fez com que Tóquio fosse destruída em 1988. Em seu lugar, foi construída Neo-Tóquio, que, em 2019, sofre com atentados...",Animação
800,Piratas do Caribe: A Vingança de Salazar,2017,"O Capitão Jack, que anda passando por uma onda de azar, sente os ventos da má sorte soprando com muita força quando os marinheiros fantasmas...",Aventura
801,Ninguém Mexe com a Vovó,2024,"Jasper é um ex-soldado que costuma visitar sua avó para realizar pequenos trabalhos domésticos. Enquanto conserta uma pia quebrada, ele precisa...",Comédia
802,Projeto X: Uma Festa Fora de Controle,2012,Três garotos no último ano do colégio decidem fazer uma festa de aniversário para serem reconhecidos. Porém no decorrer da festa as coisas saem de...,Comédia
803,Star Trek,2009,Está tudo pronto para a viagem inaugural da nave espacial mais moderna já criada: a USS Enterprise. Sua jovem tripulação tem uma missão...,Ficção
804,Um Lugar Silencioso: Dia Um,2024,"Quando Samira retorna para Nova York, sua viagem se transforma em um pesadelo angustiante quando as misteriosas criaturas que caçam pelo som...",Terror
805,Boca de Fumo,2025,"Em El Paso, Texas, um agente disfarçado da Narcóticos e seu parceiro brincam de gato e rato com um grupo ousado de ladrões: seus próprios filhos...",Ação
806,Amor e Outras Drogas,2010,"Maggie é uma mulher de espírito livre que não quer se amarrar a alguém de maneira alguma. Ela só não esperava conhecer Jamie, um charmoso vendedor...",Drama
807,Debi & Lóide: Dois Idiotas em Apuros,1994,"Dois amigos debilóides vão para Aspen, no estado do Colorado, para tentar devolver uma maleta esquecida pela passageira da limusine que um deles...",Comédia
808,Conta Comigo,1986,"Em uma pequena cidade do Oregon, quatro amigos - o sensível Gordie, o durão Chris, o destemido Teddy e o acovardado Vern - resolvem sair à procura...",Crime
809,Tarzan,1999,"Um bebê perde os pais na selva. Órfão e sozinho, ele é encontrado por uma macaca que o cria como se fosse seu próprio filho. Tarzan cresce...",Animação
810,Nosferatu,2024,"Um conto gótico de obsessão entre uma jovem assombrada na Alemanha do século XIX e o antigo vampiro da Transilvânia que a persegue, trazendo...",Terror
811,Beleza Americana,1999,"Lester Burham não aguenta mais o emprego e se sente impotente perante sua vida. Casado com Carolyn e pai da ""aborrecente"" Jane, o melhor momento...",Drama
812,Mortal Kombat Legends: Batalha dos Reinos,2021,"Os heróis de Earthrealm devem viajar para Outworld e lutar pela sobrevivência de sua terra natal, invadida pelas forças do malvado senhor da...",Animação
813,Kill Bill: Volume 2,2004,"Após ser traída por Bill e seu antigo grupo, a Noiva assassina fica à beira da morte por 4 anos. Após despertar do coma, ela vai atrás de cada um...",Ação
814,Morte no Nilo,2022,"Durante suas férias no Egito, Hercule Poirot precisa investigar o misterioso assassinato de uma jovem herdeira a bordo de uma embarcação no rio Nilo.",Mistério
815,"Se Beber, Não Case! Parte II",2011,"Phil, Stu, Alan e Doug viajam à exótica Tailândia para o casamento de Stu. O que poderia dar errado? Dois anos depois da desastrosa despedida de...",Comédia
816,Calígula,1979,"Após a morte do paranoico imperador Tibério, Calígula, seu herdeiro, toma o poder e mergulha o império em uma espiral sangrenta de loucura e...",Drama
817,Edward Mãos de Tesoura,1990,"Peg Boggs é uma vendedora que acidentalmente descobre Edward, jovem que mora sozinho em um castelo no topo de uma montanha, criado por um inventor...",Fantasia
818,Imparável,2024,"A inspiradora história verdadeira de Anthony Robles, que nasceu apenas com uma perna, mas com um espírito indomável e uma determinação inabalável...",Drama
819,Sing - Quem Canta Seus Males Espanta,2016,Um empolgado coala chamado Buster decide criar uma competição de canto para aumentar os rendimentos de seu antigo teatro. A disputa movimenta o...,Animação
820,Scarlet,2025,"Scarlet, uma princesa que falhou em vingar o assassinato de seu pai, acorda na “Terra dos Mortos”. Nesse mundo cheio de insanidade, se ela não...",Animação
821,Nosferatu,2024,"Um conto gótico de obsessão entre uma jovem assombrada na Alemanha do século XIX e o antigo vampiro da Transilvânia que a persegue, trazendo...",Terror
